{
  "$schema": "https://json-schema.org/draft/2020-12/schema",
  "title": "Claude Code marketplace.json, as documented at code.claude.com/docs/en/plugin-marketplaces",
  "type": "object",
  "required": ["name", "owner", "plugins"],
  "additionalProperties": false,
  "properties": {
    "$schema": {"type": "string"},
    "name": {"type": "string", "pattern": "^[a-z0-9]+(-[a-z0-9]+)*$"},
    "description": {"type": "string"},
    "owner": {
      "type": "object",
      "required": ["name"],
      "properties": {"name": {"type": "string"}, "email": {"type": "string"}}
    },
    "plugins": {
      "type": "array",
      "minItems": 1,
      "items": {
        "type": "object",
        "required": ["name", "source"],
        "properties": {
          "name": {"type": "string", "pattern": "^[a-z0-9]+(-[a-z0-9]+)*$"},
          "source": {
            "oneOf": [
              {"type": "string", "pattern": "^\\./"},
              {"type": "object", "required": ["source"]}
            ]
          },
          "description": {"type": "string"},
          "category": {"type": "string"},
          "tags": {"type": "array", "items": {"type": "string"}}
        }
      }
    }
  }
}
